<!DOCTYPE document SYSTEM "document.dtd">
<document title="test">
  <node id="Science" file="NaN">
    <title>Science</title>
    <referrers>
      <path>/Science</path>
    </referrers>
    <references>
      <path>/Science</path>
    </references>
    <see></see>
    <seen></seen>
    <node id="Math" file="NaN">
        <title>Math</title>
        <referrers></referrers>
        <references></references>
        <see></see>
        <seen></seen>
    </node>
  </node>
</document>
